<?xml version="1.0" encoding="UTF-8" ?>
<Clients xmlns="http://jd02_09.mokhart.it.by"
         xmlns:xsi="http://www.w3.org/2001/XMLSchema-instance"
         xsi:schemaLocation="http://jd02_09.mokhart.it.by Schema.xsd">
    <Client>
        <Login>Kate</Login>
        <Password>0000</Password>
        <Email>kate.d@mail.ru</Email>
        <Clothes>
            <Cloth>
                <Description>
                    Хорошая одежда, всё круто!
                </Description>
                <Price currency="RU">167</Price>
            </Cloth>
            <Cloth>
                <Description>
                    Качество очень хорошее, всем советую!
                </Description>
                <Price currency="EUR">79</Price>
            </Cloth>
        </Clothes>
    </Client>
    <Client>
        <Login>Anton</Login>
        <Password>antonio</Password>
        <Email>an@mail.ru</Email>
        <Clothes>
            <Cloth>
                <Description>
                    Очень классные вещи, советую!
                </Description>
                <Price currency="USD">193</Price>
            </Cloth>
            <Cloth>
                <Description>
                    Не лучшее качество, цена не соответсвует...
                </Description>
                <Price currency="BYN">118</Price>
            </Cloth>
        </Clothes>
    </Client>
</Clients>
